Quest,Acquisition,Walkthrough
https://masseffect.fandom.com/wiki/Citadel:_Wrex,"Prerequisite: Citadel: Expose Saren
After the Citadel Council hearing, David Anderson must be asked if there are other leads that can help the treason case against Saren. He refers you to Barla Von, a Shadow Broker agent who may be able to help. In this scenario, the mission is initially named Citadel: Shadow Broker. If you didn't ask Anderson immediately after the hearing, you can do so again at his place in the Embassies.
If you are accomplishing Citadel: Garrus without doing the above, at the conclusion of that mission Garrus Vakarian attempts to persuade you to enlist Urdnot Wrex into the team. The mission name is then acquired as is, and there's no need to speak with Barla Von anymore—simply go to C-Sec Academy to find Wrex there.","If the mission was obtained from Anderson, head to the financial district of the Presidium. Barla Von is located in the bank, next to the Emporium.
Once inside, Barla Von will tell you that he works for the Shadow Broker and the information he is about to give you would normally cost a small fortune, but he is giving it away for free. Apparently Saren has betrayed the Shadow Broker, not a good move, and now the Shadow Broker is very angry with him. You can respond to it anyway you want. Saren also conned a former Shadow Broker agent named Fist to change his allegiances to him. The Shadow Broker retaliated with hiring the krogan bounty hunter to deal with the problem.
After speaking with Barla Von, the mission name now changes to Citadel: Wrex. When you have all the information you need, head over to the elevator to C-Sec Academy. The elevator is located near the Embassies so the Fast Transit System is recommended, unless you feel like walking.
Wrex dares C-Sec officers to arrest him
Once you are in the academy, you will see several C-Sec academy officers near a krogan off to the right of the center elevator. You may want to make a save point before going up to them, as this will lead to one of the few opportunities to switch squadmates at this stage of the game.
When you approach the group, a cutscene plays. Apparently the officers hauled the krogan in because he was accused of making threats against Fist, and they warn him off, to little effect as the krogan only responds point-blank that he will kill Fist. After a brief but tense standoff, the officers leave and the krogan turns his attention to you. After some introductions, you discover that your goals and that of the krogan, Urdnot Wrex, align enough that you agree to let him join your team.
If Garrus hasn't been recruited yet when you speak to Wrex, or you have recruited him but you haven't yet gone to Chora's Den to deal with Fist, you will not have the option of refusing to allow Wrex to join you. If you haven't recruited Garrus, Wrex will mention that there is a turian who is also going after Fist. You can then either choose to go to the Med Clinic for Citadel: Garrus or just go to Chora's Den to deal with Fist.
If you have completed Citadel: Garrus and you have already gone to Chora's Den and dealt with Fist, you can still find Wrex down at C-Sec, but he won't be having a confrontation with officers. Instead, you will find him leaning against the elevator that leads up to Dock 422 where the Normandy is moored, and if you approach (unavoidable if you want to take the elevator up), a slightly different cutscene plays. Wrex is frustrated that you handled Fist, a job which the Shadow Broker had paid Wrex to handle. Out of professional pride, Wrex states he will gift Fist's bounty to you instead. He then asks to join your team and your mission to take on Saren. When pressed on why he would want to join you, he says that he wants to be ""where the action is"", and that Saren portends a major conflict to come. He also expresses disgust at what he sees as the servility and greed of the other krogan who fight for Saren, claiming that his people used to have more pride.
However, you may still refuse to allow a krogan on your team, in which case a miffed Wrex says that he will hang out at Chora's Den if you change your mind; he will remain there for a large majority of the rest of the game, and you can recruit him to your mission by speaking with him there at any time. Even if you refuse Wrex's initial offer to join you, you will still receive the bounty payment, a relatively large credit reward.
Regardless of the circumstances of when you first talk to him, if Wrex joins your team, you will be able to select your squad again, and then move on."
https://masseffect.fandom.com/wiki/Race_Against_Time:_Conduit,"Prerequisite: Ilos: Find the Conduit
This mission is renamed from Race Against Time: Sovereign upon completion of the prerequisite mission.","Exit Vigil's chamber and on the way up your squadmates will comment that even the Protheans with all their power and knowledge still fell for the Reapers' traps. However, the other squadmate counters with the fact that they have no intention of ending up the same way. Get back into the Mako and stop Saren before he can reach the Conduit. Hit the gas and rocket down the path, which is now clear of the forcefields.
This entire mission is a linear drive toward the Conduit at the end of it. As before, there are no item pickups during the driving sections, so just stay inside the vehicle as much as possible. When you reach the bottom of the ramps from Vigil's chamber, there are three Geth Rocket Troopers that are around the entrance to the trench run. Take them out and then take a left and head into the trench.
There's no incentive to step out of the Mako, so enjoy guilt-free driving through the aqueducts
Note: If, for some reason, you ditched the Mako and traveled on foot, return to it. The game will not let you into the aqueducts without it, and you cannot leave the vehicle while you're at the ledge drop area of no return. Legendary Edition:  The game now allows you to drop from the ledge of no return on foot, but it still won't allow you to disembark the Mako at the very edge. Abandoning the vehicle is definitely not an option if you want to complete the mission successfully as you won't be able to enter the Conduit without it.
Move along the trench until you reach the first turn. This area is defended by a lot of geth, mainly 4 Rocket Troopers, 3 Geth Troopers, a Geth Shock Trooper, and a Geth Colossus.
None shall break the tranquility of the place
Before turning the corner and exposing yourself to fire from the Colossus you can separately engage and take out some of the smaller geth whether you do so from in the Mako or outside it. After turning the corner you will see a second nearby group of geth who can often be lured back down the corridor with you to be dealt with away from the Colossus. You can now safely blow away the remaining small geth using the Mako's heavy gun if you're willing to give up the rather insignificant exp you'll gain at this time.
Finally the Colossus can be whittled down with the classic method of turning the Mako sideways and rocking it back and forth to avoid projectiles. At the last moment you can get out of the Mako and kill the Colossus on foot for some bonus experience.
Head through the former battlefield and turn left and head down the backstretch. When you reach a right turn head down it and be prepared to take some fire. At the next corner are three Rocket Troopers and again are easy prey. Take the double turn and drive along until you come under attack again. This group is the same as the last and is the last in the trench. When you defeat this group, SAVE YOUR GAME because the next area can be tricky.
The calm before the storm
Before moving on, get the Mako's shields to full strength (if it's going to be a tiresome wait, saving your game and then reloading it will save time) and fully repair the Mako because if you don’t then you will probably die.
At the end of the aqueduct there's nothing left but a downward slope and the Conduit at a distance. Your Mako will stop temporarily as your squadmates comment on the Conduit: one admiring the view, and one urging haste. A somewhat lengthy cutscene commences. Do NOT be lulled to sleep during the upcoming cutscene, as you will be in a timed combat sequence immediately following.
The Battle of the Citadel begins as the Reaper and its geth allies arrive through the mass relay and unleash a devastating broadside on the unsuspecting Citadel Fleet. The Citadel forces counterattack and attempt to seal the station by closing its arms as a defensive measure, but they are unable to do so. The commander of the Destiny Ascension then orders the evacuation of the Council. The reason for the station's unresponsiveness becomes clear as the scene shifts to the Presidium where a geth throws the lifeless body of an asari aside while Saren and more of his mechanical minions enter the elevator leading to the Citadel Tower and the Council Chambers.
The approach to the Conduit
When you regain control you have only 40 seconds to get to the Conduit and use it. You will not make it on time if on foot, so you must drive, and fast. However, there are four Geth Colossi in your way who will try to stop you. Therefore, you have no time to combat them, just hit the gas and take the most direct route to the Conduit while avoiding their projectiles. Following the small river and zigzagging a little to reduce the machine gun fire from the Colossi is a reasonable plan, though driving straight at the Conduit generally works just as well. Legendary Edition: While in the original game you'll probably be cutting it close even at top speed, the Mako's rear thrusters can now ensure you reach the Conduit with a comfortable lead (but still not enough of one to kill all Colossi).
Be aware that the Mako's shields will be automatically depleted to a couple of bars when it hits the bottom of the ramp. When you get close enough to the Conduit, it will automatically take the Mako and send it to the Citadel. Warning:  Attempting to enter the Conduit on foot will result in instant death.
The only spot where you can park and snipe Colossi without triggering the cutscene
Tip: It is possible to take out 2 of the 4 Colossi before you even start the cutscene. Your best and only vantage point is a few feet from the top entrance, the boundary defined by the walls textured with many horizontal stripes: any farther out and the cutscene will start. The Colossi can be destroyed with sniper rifles, but as it will take an infernally long time to do so even with the Mako's weaponry, it isn't advisable. Kill them with the Mako gun and cannon instead.
One Colossus is to the right of the bottom of the ramp and the other is to the far left. Look for the faint blue lights. You can double zoom your sight to make it easier to see over the lip of the canyon: the left Colossus should appear as a moving white blur obscured by foliage while the right one should have much more definition."
