Quest,Acquisition,Walkthrough
https://masseffect.fandom.com/wiki/Noveria:_Quarantine,"Prerequisite: Noveria: Matriarch Benezia
This mission is acquired during your pursuit of Matriarch Benezia within Peak 15. Speak with Dr. Cohen at Rift Station's Medical Bay regarding the sick scientists. He's reluctant to say anything because he has a non-disclosure agreement, so you must persuade him. If you tell him it's his call, you won't get the mission, though you can try to persuade him again afterward.
Warning:  If at any time you decide to turn the guards hostile, Dr. Cohen will either disappear or refuse to talk to you, rendering the mission impossible to acquire. If the mission is already underway, it becomes unable to be completed and will remain open in the journal even after completion of the main Noveria mission.","Ventralis has sealed off a lab where they were researching a bio-weapon; however, Ventralis mistakenly believes that it is still viable. Cohen assures Shepard that it is neutralized because of a brief exposure period, and he needs the cure they were researching to heal the other members of his team. If you charmed or intimidated Cohen for specifics, you'll learn about the toxin Thoros-B and its origins.
A couple of scientists sleeping through a crisis
If you require it, the Mira terminal in the medical bay can completely heal you and your squad. If you haven't obtained the primary Codex entry for medi-gel yet, the medical station right next to the terminal can be bypassed for some Phoenix Armors, XP, and medi-gel if you're below maximum (easy decryption). Note:  unlike most bypass jobs, if you cancel or fail the minigame, you won't get anything other than the Codex entry.
Go back and see Ventralis and after some persuasion he will give you access to the lab; head toward Quarantine and Barracks to get access to it. When you exit on the lower level you see Han Olar, talk to the volus to get information about the rachni and what happened at the station. Once you have all the information you want, before heading into the lab loot the storage locker (easy decryption) and if necessary access the Medical Station. Then talk to the guard and head inside the lab.
Bad idea to take cover behind the brown boxes: they're very destructible
Note:  Once you're in the lab, the guard won't let you out until you have completed the cure.
At the other end of the room is what you need to make the cure. Before you make the cure however head into the second door on the right and grab the med kit. The third room has a secure storage locker (average decryption), and there is a locked crate (easy decryption) next to the table. Finally, if you haven't acquired the codex entry for Thresher Maws yet it's just by the equipment near the terminal, labeled Xenobiological Database.
Access the research notes to figure out how to make the cure and then use the next station to make the cure. For that just push the Change Vial button each time the progress bar reaches proper concentration (is between two sliders). When you make the cure however you have some company.
Flatten them first before they do the same to you
Alestia Iallis enters with 2 Geth Troopers and an Asari Commando. You will share words (very brief ones, depending on your dialogue choice), but there is no talking your way out of one of the more dangerous fights in the entire game. When the conversation ends, you and your squad should take immediate and decisive action to disable as many of the attackers as possible. If you have Lift or ideally Singularity use them ASAP. Damping or Sabotage are also good opening moves, as is immediate activation of Immunity to keep you safe in case you are ragdolled by the biotics that will come flying at you. Focus on Alestia because she tends to be the greatest threat. Once she is down, focus on the Commando if present, then the geth.
Once they are all down head out of the lab and Han Olar will tell you that they came from the maintenance areas. With that information then head back up the elevator and head to Dr. Cohen to hand over the cure. The conversation can go a couple of ways, so you need to specifically talk to Cohen about the maintenance areas to get his pass. With some persuasion you can also weasel some medi-gel (4 Charm or 8 Intimidate) out of him.
The mission concludes after the dialogue with Cohen, yielding XP and 24 Paragon points. If you want to, talk to Ventralis again to tell him about Alestia. Before leaving visit Petozi for any last trading because it will be your last chance."
https://masseffect.fandom.com/wiki/Virmire_(mission),"This mission is acquired after the completion of two of the first three plot worlds: Therum, Noveria, or Feros.
The next time you try to access the Galaxy Map in the Normandy, Joker informs you of a priority call from the Citadel. If you ask if it's from Udina, nope, it's from the Council. You cannot travel to other star systems while this is pending, so might as well take the call in the comm room.
The Councilors inform you that a salarian recon team sent nothing but static on a mission-priority channel. They reason they wouldn't have sent anything if it wasn't important, so they want to apprise you of all your options. The signal originated on Virmire, so you must go there to investigate.
The asari and salarian Councilors do most of the talking. If you want to antagonize them, the turian Councilor will speak up to offer his counterarguments. Morality points can be had in this exchange.","If you visit the Citadel and ask Anderson about this, he'll say that he has never even heard of Virmire before the Council passed the information to Shepard.
Virmire is in the Hoc system of the Sentry Omega cluster.
Drop Off[]
Under the radar
When the Normandy is approaching Virmire, Joker picks up the signal from the Salarian STG team, and Kaidan takes notice of the massive defense towers that surround Saren’s base. Joker will tell Shepard that he will get the Mako in under Saren’s radar. The Normandy swoops in and drops the Mako at low altitude. Once the Mako rolls to a stop, Joker comes over the radio and calls for a successful drop. Respond, but basically Shepard says the same thing. Shepard orders Joker to keep the Normandy out of range until the AA guns are down. You will notice some animals around, however they are harmless and don’t attack so ignore them.
Climb into the Mako and head off. There are no item pickups in the driving sections of the map, making it convenient if you don't plan on disembarking from the Mako unless absolutely required. Be careful near the ocean's edge, because the Mako can drive over the rocks leading to a Critical Mission Failure.
Around the second corner you will encounter some Geth Rocket Drones and Geth Assault Drones. These are actually harder to take out from the Mako than on foot, so exit and start shooting. Keep moving forward, taking out another group of drones along the way.
Insanity Tips: Rockets and especially snipers can one-shot Shepard on this level, so be careful getting out of the Mako when there is a large group around. Remember to turn the Mako sideways to any large enemies and ""rock back and forth"" to avoid rockets; likewise when you're outside the Mako and in the great outdoors where there isn't much cover, keep on the move while you shoot to avoid incoming missiles. But if you've made it this far on Insanity level you won't find anything in the vehicular section of Virmire too difficult.
The Mako rewriting the definition of ""roadkill"" with a geth Juggernaut
Ahead on the right are some Geth Rocket Troopers that just love to shoot rockets, so make sure they get only a shot or two off before they are scrap metal. Around the next corner are a bunch of Pod Crabs, two Geth Rocket Drones, and a Geth Juggernaut. Take out the hostiles any way you wish then move up to where they were to get a better shot at the accompanying Rocket Troopers.
About halfway down the next stretch you will come under rocket fire and your Mako radar will become jammed. Disembarking from the vehicle lifts the jamming and allows you to save, but restricts enemy detection to only a few meters from your team. There are some Rocket Drones at the end, so deal with them and then round the corner. On a bank to the left are three sets of geth shields and of course some more geth: four Rocket Troopers, two Assault Drones, and another Rocket Drone. Some may be hiding behind the rocks so you have to move up to take them all out. When they are down, head around the next corner and you can see a structure in the distance.
Gatehouse One[]
They hit you hard, you hit back harder
When you get close to the first gatehouse you start to come under fire from the geth guarding it. The group outside consists of two Geth Rocket Drones, one Rocket Trooper, and two Troopers. You can drive up and take them out on foot, or shoot them from a distance. Depending on your movements some of the defenders upstairs may come out of their initial positions to engage you, so be mindful. This also applies to the defenders of the other gatehouses down the road.
When all the initial geth are down, move up, if you haven’t already, and head up the stairs to the left. There are two more Troopers on the top, who may or may not have engaged the fight along with the troops below. In the far room accessible through a bare short tunnel is a Hardened Weapon Locker (hard decryption) plus two Geth Stalkers, a Geth Ghost, and a Geth Sniper (Legendary Edition:  The short tunnel has been furnished with two crates for cover, and as the next two gatehouses have similar architectures this also applies to them as well). There is also another Weapon Locker (easy decryption) on a wall before the tunnel to the gatehouse control room, be sure to open it before you leave. When you are done head back to the Mako and drive along.
Gatehouse Two[]
Consulting your map, the path from the first to the second gatehouse splits into two then merges again. Whichever path you take is immaterial as they both have enemies there: if you're not in a hurry, blast 'em all, or if you're speedrunning, pick one path and speed through.
The mako adding geth colossi to its list of roadkills
Just outside the first gatehouse and before the split there is a Geth Colossus on your way. On both forks of the path there are an initial two Geth Armatures each. The path that appears closed off on your map is actually just a narrow archway, and it has another Geth Colossus beyond it. The alternate path has another Geth Armature and another Geth Colossus in separate places.
Aside from the standard gun them down then exit the Mako for the killing blow for maximizing exp if you aren't playing Legandary Edition, you can take advantage of the level geometry and ram them off the ocean barricades for instant death if the opportunity appears, just be vigilant you don't overshoot the Mako and drown yourself. The colossi are particularly situated for this tactic though the armatures can also be victimized if you're diligent enough. The walkers are very susceptible to ramming and they waste a lot of time trying to reorient after such an attack, so do it often and preemptively especially if they're about to fire their Siege Pulse weapons.
As you get closer to the second gatehouse you may be hit with a powerful radar jamming that will obscure the enemy walker count if you aren't done dealing with them yet. Disembark from the Mako, equip your (or your squadmates') preferred weapon with your most powerful detection upgrades, then board the vehicle again. The jamming source is inside the gatehouse so dealing with it will have to wait until you arrive there.
Two geth Destroyers and a Sniper guarding Gatehouse Two's controls
The second gatehouse is similar to the first except the stairs are on the right and you cannot proceed further until you disable the artillery holding the Normandy back in the control room. Hostile headcount in the gate level is just a Rocket Trooper, a Geth Shock Trooper, and a Geth Sniper. Upstairs is another Rocket Trooper and Shock Trooper. Defending the control room is a Geth Sniper and two Geth Destroyers.
The control room has the toggles for the AA guns as well as the gatehouse doors. Switch off the guns first, then open up the doors, and get looting if you haven't yet. In the room is a Secure Weapon Locker (average decryption), and on the far side wall along the stairway is a crate.
When the AA tower is down, Joker radios that he is on approach to the salarian camp, you’re done here so get back into the Mako and drive on.
Gatehouse Three[]
As you drive under the gatehouse, the Normandy flies overhead en route to the salarian camp.
Color them shocked when three organics and a tank demolish the prior gauntlet of geth
When you round the corner you encounter the last gatehouse and the final line of defense before the camp. As with the second gatehouse you must raise the gates at the control room before you can pass. Enemy composition here is a Rocket Trooper and two Troopers at ground level, three Shock Troopers inside the gatehouse building, and two Destroyers in the control room. Lootables include a Hardened Weapons Locker (hard decryption) in the control room and a crate along the wall by the entrance tunnel.
When you reenter the Mako, just gun it because there are no more enemies between you and the salarian camp. When you get closer Joker radios that the Normandy is down safely but they are apparently grounded, the salarian captain can explain when Shepard arrives.
Salarian Camp[]
Saren's forces apparently don't notice hostiles squatting right next to their walls
When you reach the camp you are rewarded with credits and experience. A cutscene plays where Ashley and Kaidan are arguing with the salarian captain. The captain needs more time to come up with a plan, and when Shepard arrives, he introduces himself as Captain Kirrahe, 3rd Infiltration Regiment, STG. Kirrahe asks if Shepard was all the Council sent and is dismayed when he learns that his transmission was unclear. He lost half of his men investigating this place and Shepard’s orders were just the same.
When asked he talks about the base, apparently heavily fortified and guarded by a legion of geth. Kirrahe mentions that Saren is breeding an army of krogan. If you recruited Wrex to your team, he walks over and asks how that's possible. Kirrahe says that Saren found a cure for the genophage and it needs to be destroyed. Wrex disagrees, but Kirrahe insists as he thinks the krogan were a mistake. Wrex gets in Kirrahe's face, stating ""[w]e are not a mistake!"" Kirrahe requests that you resolve the issue with Wrex while he comes up with an assault plan.
Main article: Virmire: Wrex and the Genophage
This mission is then renamed Virmire: Saren's Plan in the journal. When you regain movement control, you can explore the camp at your own pace. Every NPC in the area (except the salarian pacing by the beach) has dialogue lines you can explore, and may change depending on how you dealt with Wrex. Squadmates also temporarily become NPCs: they stand around the camp in their original armor regardless of whatever you got for them, though this is merely a cosmetic change and they'll wear your preferences next mission.
Somebody's not going home today, and the decision is entirely yours
The tent nearest to the base wall has a codex entry from the Communications Relay (easy decryption). Liara loiters here if you already rescued her from Therum. Wrex is on the beach in front of her, intermittently blasting at the shore and the air with his shotgun until you talk to him.
The central tent has Kirrahe, who is your key to story progression. If you dealt with Wrex already, or if the krogan was never in your party to begin with, speak to him to get things going. Ashley and Kaidan  hang around in here initially.
The tent at the other side of the camp has Commander Rentola, Kirrahe's second-in command and supply officer. Beside him is a Medical Station (easy decryption). He has a limited selection of goods to sell but it is a good place to unload unnecessary gear before heading out. Sell any excess items you've accumulated to Rentola, because there's a long segment coming up and you don't want to end up at your inventory limit. Tali and Garrus can also be found in Rentola's vicinity: Tali inside the tent, and Garrus on the beach outside if you recruited him.
Note:  You cannot rely on the decryption skills of your squadmates here on the salarian camp - if you play as a Soldier or have low decryption skills on your own the med station and the comms relay will remain inaccessible.
""Bit of a cloaca, though. Loved his speeches. Hold the line!""
When you are ready, head back to Kirrahe and he says that he has come up with a plan, sort of, and involves high risk and a lot of luck. He will divide his men into three teams and hit the front of the facility while Shepard and team “Shadow” sneaks around back. When asked about the team names Kirrahe will list of the other three: Aegohr, Mannovai, and Jaëto, the salarians' first three colony worlds. He hopes that they will remind the men what they are fighting for.
He also needs to ask Shepard for a huge favor, he needs one of Shepard’s squad for the assault. Both Ashley and Kaidan volunteer. Send whomever you wish with Kirrahe, however be warned that whichever one you send will be unavailable as a squadmate for the rest of Virmire. Personal preference or squad balance, keep whichever in mind when choosing.
When you are done Kirrahe gives you one last opportunity to hold off before the attack, if you do then just talk to him again to proceed. When you get ready to proceed, Kirrahe gives a speech to the men then wishes Shepard luck and asks the Commander to be on the lookout for anything that can assist the teams. When the squad selection screen comes up, there's your cue to navigate on to the next part of the mission."
https://masseffect.fandom.com/wiki/Noveria:_Rift_Station,"Prerequisite: Noveria: Matriarch Benezia
This mission can be acquired in 3 ways:
Play stupid games, win stupid prizes: bypass the door despite warnings and see what it gets youBy approaching the sealed-off doors at the restricted area of the Rift Station main level. A computer voice will alert you that the ""Watchdog Protocol"" is active.
Being accosted by Han Olar after Alestia Iallis' attack during Noveria: Quarantine will update your journal if you haven't done the former yet.
If you did Noveria: The Hot Labs first, your journal updates with the mission entry whichever way you choose to reach the Secure Lab as detailed below. The upper entry is gained if you went through the Restricted Area, while the alternative entry is gained if you went through the Ventilation Room via Scientist Barracks.","In order to progress the story you'll eventually need to get into the Secure Lab. Consult the maps for both main and lower levels of Rift Station for directions and location labels.
Breaking In[]
One way is through the restricted area at the Rift Station Main Area.
This route provides extra fighting, though not particularly difficult, and accompanying extra experience and credits. Warning:  If you do this, all Rift Station characters will react with alarm to your actions and will not transact with you again. No more shopping from Petozi, and you can never acquire nor complete Noveria: Quarantine upon turning everyone hostile.
Take advantage of the level design to efficiently get rid of these rent-a-cops
Begin by hacking the door to the ""Restricted Area"" -- it's near the med bay, and has two Assault Drones guarding it. The drones will attack immediately - gun them down. Then, before entering the door, you have the option of returning to the room you just left and fighting the guards there. Also optionally, you can head all the way back to Captain Ventralis and dispose of him and his two henchmen.
Enter the door you hacked and fight your way through another series of guards along a corridor. In this S-shaped corridor on your map you may face up to 9 ERCS Guards, all toting shotguns and assault rifles, so expect engagements at close to medium ranges. There are numerous explosive containment cells you can destroy to damage (or kill) some of the guards. The area has both indestructible and destructible cover in equal measure, so you can prevent hostiles from cowering behind the brown boxes if the need arises.
The corridor leads to an elevator. Beyond the elevator is a technician kit and an upgrade kit on the floor. On your map there are two routes: to the Secure Lab, which is where Benezia is, and to the Ventilation Room, which is where you would have gone if you chose the sneaky route.
Sneaking In[]
Main article: Noveria: Quarantine
Another way is through a maintenance back door at the Quarantine Lab. Approach Dr. Zev Cohen at the Med Bay, and after doing the Noveria: Quarantine mission for him ask for his back door pass. This is the most peaceful option available and results in relatively minor casualties.
Note that upon successfully sneaking in, you can still choose the alternative of fighting your way in for extra credits and experience.
Wrong place, wrong time
Head back down past Han Olar and into the maintenance area, which looks like a cave. You will enter unopposed and without being detected, and will not provoke fights with guards. On the way there is a solitary Rachni Soldier, so kill it and enter the back door. The alternative journal entry above overwrites the first one once you reach the door.
When you walk through there is a secure storage locker (average decryption) on the catwalks. The room after this goes only two ways: to the Secure Lab, or backtrack to the mess hall via the Restricted Area elevator. If you wish to pick a fight with the guards above, ignore the Watchdog Protocol warning and take the elevator up. Otherwise, just loot the upgrade and technician kits before the elevator. Once you are done head back to the Secure Lab door and save your game before entering.
Ventralis and the Hot Labs[]
Surprise, we're not actually friendly
Now, if you decided to pursue the lead at the Hot Labs before dealing with the business inside the Secure Lab, upon your return to the mess hall Ventralis surprises you with treachery, revealing himself and the entire security force to be under Benezia's employ.
They're all shielded and fairly clumped together at the mess hall, so crowd control talents will put them down quickly. You are also fairly exposed despite the presence of cover, so retreating back beyond the door you came in to whittle them down is a viable solution. Of the four ERCS Guards with Ventralis, two wield the standard shotgun/assault rifle weapons, one has a sniper rifle/pistol combo, and one has a pistol only. Be particularly wary of surprise assassinations.
In this scenario, everyone in the facility is either out to kill you (the guards and drones) or absent (the other characters except Han Olar down at the Scientist Barracks). If you mixed the cure for Thoros-B on Noveria: Quarantine, you can't return it to Dr. Cohen anymore. You obtain additional combat rewards in this manner but at the expense of NPC presence. You may learn from Olar later that Ventralis had the most of the civilians killed to cover up Binary Helix's mistake with the rachni.
Doubly-traumatized volus can't be asked to care anymore
As before, you can reach the Secure Lab by going through the Restricted Area and the baddies there, and/or the maintenance tunnel next to the Scientist Barracks. The doors to both are already unlocked compared to the previous scenarios, with the same number of enemies and lootables on either route give or take a few things. If you decide on the maintenance tunnel path first, on reaching the Scientist Barracks you'll see Han Olar being threatened at gunpoint by an Asari Commando. After a short cutscene, you'll need to deal with the commando and the 2 ERCS guards there. If you decide on the Restricted Area first then backtrack via maintenance tunnel, you'll only see 2 ERCS guards at the Scientist Barracks, with no trace of Han Olar or the commando.
Fate of a Species[]
The Queen speaks through the asari
The mission ceases to be of relevance once you reach Benezia in the Secure Lab; see Noveria: Matriarch Benezia for handling the showdown with her. However, it is brought to the fore again shortly afterward.
When Benezia finally dies, move a bit closer to the Rachni Queen's tank. You will enter a conversation with the Rachni Queen through one of the dead commandos. The dialogue factors in whether you've dealt with Noveria: The Hot Labs yet or not. You can ask questions about her history and her plans if Shepard releases her. Now you have the ultimate choice: activate the acid tanks and kill off the rachni once and for all, or allow the Queen to leave and begin anew.
You get a cutscene showing your actions. The mission is marked complete when you reach a decision regarding the Queen."
