Quest,Acquisition,Walkthrough
https://masseffect.fandom.com/wiki/First_Strike,"Prerequisite: Nexus Reunion
Interact with the Strike Team terminal next to Tiran Kandros in the Militia Office on the Nexus to begin this mission.","Speak to Kandros on the Nexus or via the Tempest's vidcon[]
Upon first activating the terminal, SAM tells Pathfinder Ryder that he does not have sufficient authorization to access that function. Speak with Kandros in person on the Nexus or via vidcon to gain the authorization required.
Inspect available Strike Team missions[]
See also: Strike TeamsPay attention to the blinking orange light beneath the hologram
Use either the Strike Team terminal in the Nexus security office or onboard the Tempest to view available operations. This will complete the mission.
Note: It is not necessary to undertake any of the online multiplayer missions to complete the game storyline."
